id,标题,成文或生成日期,发布或生效日期,来源,URL源地址,内容
12,漳州首条市民定制公交线路开通,2018-12-28,2018-12-28,漳州日报,https://www.zhangzhou.gov.cn/cms/html/zzsrmzf/2018-12-28/1462699675.html,据悉，为满足群众多样化出行需求，漳州市公交集团通过前期定制公交投票系统调查，征集采集群众乘车需求意见，最终投票结果表明，高校园区至漳州火车站的公交出行需求最大，于是该条线路应运而生。该专线线路编号为D1(定制公交1号线)，由漳州卫院至漳州火车站，走向为西洋坪路-大学路-金峰中路-金峰南路-瑞京路-师院西路-江滨路-九龙江大桥-龙江南路。线路主要停靠站点为漳州卫院→西洋学生公寓→金峰卫生服务中心→闽南师大达理公寓→闽南师大南门→漳州火车站(上下行一致)。运营时间为每周五、六、日，节假日另行计划(以定制公交系统界面班次信息为准)。漳州卫院为：首班7:30，末班16:30；漳州火车站为：首班9:00，末班17:30。线路总运营18公里，全程实行一票制6元。D1专线已于12月27日开启网上购票。大家可关注“漳州公交集团微信公众号”，进入“定制公交”菜单，通过简单的注册和登录后点击“班次定购”，选择线路、班次时间和上下车站点。完成支付后，系统自动生成一个二维码(即电子车票)，乘客上车后调取二维码，扫码完成验票，按照系统生成的座位号就座。(记者 庄文剑)
13,漳州一批部门挂牌成立,2018-12-28,2018-12-28,漳州日报,https://www.zhangzhou.gov.cn/cms/html/zzsrmzf/2018-12-28/598212626.html,
14,市委人才工作领导小组第四次会议召开,2018-12-28,2018-12-28,漳州日报,https://www.zhangzhou.gov.cn/cms/html/zzsrmzf/2018-12-28/1506473099.html,会议要求，要提高认识、强化责任，进一步增强做好人才工作的责任感和紧迫感，将人才工作贯穿到全市经济社会发展的全过程，以人才优先发展之功，收人才引领发展之效。要上下联动、形成合力，牢固树立人才工作“一盘棋”的思想，坚持市县联动、部门协同，提前谋划明年工作，并着力构建横向到边、纵向到底的人才工作组织体系，做大、做强人才工作格局。要优化服务、提升实效，积极发挥好漳州市高层次人才网的作用，加快开通高层次人才服务卡，并根据实际研究出台针对性强的人才队伍建设服务举措，下大力气解决人才工作的重点、难点、热点问题，真正实现人才引得进、留得住、过得好，为加快建设富美新漳州、当好新福建建设先锋提供有力的人才支撑和智力支持。会议还研究确认了2018年下半年省、市引进高层次人才和省工科类青年专业人才支持对象；研究通过漳州市文化名家、有突出贡献中青年医疗专家、名医工作室、人才驿站等有关事项。(记者 郑来珍)
15,市农民体育协会第七届会员代表大会举行,2018-12-29,2018-12-29,漳州日报,https://www.zhangzhou.gov.cn/cms/html/zzsrmzf/2018-12-29/101957477.html,"会议回顾总结市农体协过去五年多来的工作，并对新一届工作提出要求。大会选举产生新一届农体协委员，选举陈易洲担任主席。会议指出，农民体育事业是一项系统工程，是体育事业重要组成部分,是全民健身活动的重要方面。各有关部门要紧密贴近“农业农村农民”，牢牢抓紧“农趣农味农俗”，组织更多农民健身比赛，不断提高农村活跃指数、农民幸福指数，助力乡村振兴战略全面实施。要立足实际，务求实效，因势利导把农民健身元素融合到民间民俗活动，让农村年节民俗活动成为农民新的健身阵地。要紧盯时代发展特点，大力培养农民体育品牌项目，开展“一村一品”“一镇一品”活动，让农体品牌成为标杆旗帜，以点带面，引领农民体育工作深入广泛持久开展，开创农民体育健身事业新局面。（记者 王心如）"
16,2018中国食品名城（漳州） 食品交易会今日举行,2018-12-29,2018-12-29,漳州日报,https://www.zhangzhou.gov.cn/cms/html/zzsrmzf/2018-12-29/602410316.html,此次活动共有片仔癀、天福、紫山、立兴等445家食品企业参展，其中特装展位33个、交易展位412个。此外，厦门糖巢、长沙喜吖吖、郑州爱上零食屋等近4000家采购商（经销商）报名参加此次活动。交易会期间，我市还将举办漳州食品产业发展大会暨技术对接大会、第二届中国食品名城（漳州）食品名片颁奖盛典、2018中国食品名城（漳州）食品交易会开馆等活动及一系列对接洽谈活动。我市将充分利用交易会契机，招商引资，力争签约一批合同、引入一批新客户，打响漳州“中国食品名城”品牌，真正做到一时办会、一年做事、线上线下交易“永不落幕”。（记者 陈益雄 廖瑜婷 通讯员 薛小明）
17,漳州举行首届“水仙花奖” 原创舞蹈大赛,2018-12-29,2018-12-29,漳州日报,https://www.zhangzhou.gov.cn/cms/html/zzsrmzf/2018-12-29/441394310.html,本届大赛从今年6月份开始筹备，经过半年时间在全市范围内的海选，10个少儿组节目和9个成人组节目成功入围。最终，《布袋薪传》《小鞋子》获得少儿组表演一等奖，《布袋薪传》《柚花飘香》获得少儿组创作一等奖，《家园》《让爱回家》双双获得成人组表演、创作一等奖。据悉，本届舞蹈大赛期间，还举办了闽南舞蹈创作交流研讨会，旨在挖掘闽南原生性舞蹈形态，提炼舞蹈动律组合，提升闽南舞蹈规律性特征，更好地将闽南民间舞蹈发扬传承。（记者 周杨宁 见习记者 杨瑞）
18,市食品工业协会第二届会员代表大会举行,2018-12-29,2018-12-29,漳州日报,https://www.zhangzhou.gov.cn/cms/html/zzsrmzf/2018-12-29/1012494675.html,会议审议通过市食品工业协会第一届理事会工作报告、财务收支报告，通过市食品工业协会《章程》《会费管理办法》修改草案，选举产生市食品工业协会第二届理事会，并召开市食品工业协会第二届理事会第一次会议，选举产生第二届理事会会长、常务副会长、副会长、秘书长，何红孙当选协会会长。会议强调，市食品工业协会要进一步强化服务职能，拓展服务领域和内涵，维护会员合法权益，切实当好在漳食品企业的“娘家”。要进一步发挥桥梁作用，做好政府与企业之间的“上情下达、下情上传”工作，强化行业自律，促进产业纵向、横向资源整合。要进一步加强协会自身建设，及时跟踪产业发展动态，不断提升自身服务水平、办会水平，壮大协会力量，促进我市食品产业持续健康发展。（记者 王心如）
19,省委统战部来漳 开展“回头看”检查,2018-12-29,2018-12-29,漳州日报,https://www.zhangzhou.gov.cn/cms/html/zzsrmzf/2018-12-29/1966759605.html,座谈会上，市委统战部作贯彻落实中央、省委关于统一战线一系列重大决策部署情况汇报。会议回顾近年来、特别是今年9月接到“回头看”通知以来，我市深入贯彻落实习近平总书记关于统战工作的新理念、新思想、新战略，始终坚持把统战工作摆在全局工作的重要位置，努力解决涉及民族、宗教、港澳、非公有制经济等领域的遗留问题和突出矛盾，推动中央、省委重大决策部署在各领域得到扎实有效落实的工作情况。调研组充分肯定我市工作，并对具体工作做出指导。调研组还与有关单位、团体领导干部和党外代表人士座谈。（记者 陈瑞珠）
20,漳州市医疗保障局挂牌成立,2018-12-29,2018-12-29,漳州日报,https://www.zhangzhou.gov.cn/cms/html/zzsrmzf/2018-12-29/1075599408.html,按照《漳州市市级机构改革实施方案》要求，我市将市财政局（市医疗保障管理局）承担的城镇职工和城镇居民基本医疗保险、生育保险、新型农村合作医疗、药品和医疗服务价格管理、药品配送管理、医疗救助等职责划入市医疗保障局，作为市政府工作部门，正处级。县级医疗保障部门对应市医疗保障局相应划转职责，作为市医疗保障局的派出机构。
21,漳州市卫生健康委员会挂牌成立,2018-12-29,2018-12-29,漳州日报,https://www.zhangzhou.gov.cn/cms/html/zzsrmzf/2018-12-29/2094353655.html,按照《漳州市市级机构改革实施方案》要求，我市将市卫生和计划生育委员会、市深化医药卫生体制改革领导小组办公室的职责，以及市民政局的市老龄工作委员会办公室职责，市安全生产监督管理局的职业安全健康监督管理职责等整合，组建市卫生健康委员会，作为市政府工作部门，正处级。保留市老龄工作委员会，日常工作由市卫生健康委员会承担。不再保留市卫生和计划生育委员会、市深化医药卫生体制改革领导小组办公室。市领导强调，要充分认识做好机构改革工作的重要性和必要性，把思想统一到中央和省委市委的决策部署上来，尽快熟悉和履行所承担的职责，尽快配合做好职能转化和“三定”，同时把抓班子带队伍作为重中之重，抓紧抓实当前各项工作，为坚持高质量发展落实赶超、加快建设富美新漳州作出新贡献。（记者 吴丽燕 见习记者 杨瑞）
22,漳州市生态环境局挂牌成立,2018-12-29,2018-12-29,漳州日报,https://www.zhangzhou.gov.cn/cms/html/zzsrmzf/2018-12-29/2128547462.html,按照《漳州市市级机构改革实施方案》要求，我市将市环境保护局的职责，以及市发展和改革委员会的应对气候变化和减排职责，市国土资源局的监督防止地下水污染职责，市水利局的编制水功能区划、排污口设置管理和流域水环境保护职责，市农业局的监督指导农业面源污染治理职责，市海洋与渔业局的海洋环境和渔业水域生态保护职责等整合，组建市生态环境局，作为市政府工作部门，正处级。县级生态环境部门对应市生态环境局相应划转职责，作为市生态环境局的派出机构。不再保留市环境保护局及各县（市、区）的环境保护局。（记者 蔡柳楠）
23,中国共产党漳州市第十一届委员会第八次全体会议决议,2018-12-29,2018-12-29,漳州日报,https://www.zhangzhou.gov.cn/cms/html/zzsrmzf/2018-12-29/1654633109.html,全会的主要任务是，认真学习贯彻习近平总书记在庆祝改革开放40周年大会上的重要讲话和省委十届七次全会精神，从改革开放40年的伟大实践中汲取力量、坚定信心，进一步动员全市人民以习近平新时代中国特色社会主义思想和党的十九大精神为指导，坚持高质量发展落实赶超，加快建设富美新漳州，奋力当好新福建建设先锋，在更高起点上推动新时代改革开放再出发。全会充分肯定一年来市委常委会的工作。一致认为，市委常委会深入学习贯彻习近平新时代中国特色社会主义思想，认真贯彻落实省委省政府决策部署，坚持稳中求进工作总基调，以供给侧结构性改革为主线，紧扣坚持高质量发展落实赶超这一战略目标，着力抓牢抓实增长点，着力深化改革扩大开放，着力延展“生态+”效益，着力保障和改善民生，着力唱响时代主旋律，着力民主政治建设，着力全面从严治党，加快建设富美新漳州，经济社会呈现发展态势稳、民生保障稳、社会治安稳、风险防控稳的良好态势。全会指出，习近平总书记在庆祝改革开放40周年大会上的重要讲话，深刻阐释了改革开放的伟大意义，全面总结了改革开放的伟大成就，深刻揭示了改革开放的宝贵经验，庄严宣示了新时代全面深化改革开放的坚定决心。全市各级各部门要把学习贯彻习近平总书记在庆祝改革开放40周年大会上的重要讲话和省委全会精神作为重大政治任务，学思践悟、融会贯通，坚定不移地将新时代改革开放旗帜举得更高更稳。全会指出，40年来，全市人民风雨同舟、铁心拼搏，书写了我市改革开放的恢宏篇章，综合实力显著增强，产业结构优化升级，改革攻坚持续深化，对外开放不断拓展，基础设施日益完善，生态建设成效突出。特别是党的十八大以来，全市上下坚持以习近平新时代中国特色社会主义思想和党的十九大精神为指导，坚持高质量发展落实赶超，经济社会发展迈上了新台阶。全会指出，漳州改革开放40年来取得的成就，得益于我们坚持以改革创新的精神谋划和推动漳州各个时期、各个领域的建设和发展，坚持解放思想、实事求是，紧紧扭住经济建设中心不动摇，把人民对美好生活的向往作为始终不渝的奋斗目标，全面从严管党治党。全会强调，40年漳州改革开放和全国、全省一样，积累了许多宝贵经验，归结起来就是习近平总书记在庆祝改革开放40周年大会上提出的“九个必须坚持”。这“九个必须坚持”是我们党和人民弥足珍贵的精神财富，必须倍加珍惜、长期坚持，在实践中不断丰富和发展。全会指出，在更高起点上推动新时代改革开放再出发，是贯彻党中央部署、不负省委期望的必然要求，是把握发展大势、赢得竞争优势的必然要求，是适应党的建设需要、实现自我革命的必然要求。全市各级党组织和广大党员干部群众要坚持以习近平新时代中国特色社会主义思想和党的十九大精神为指导，坚持党对一切工作的领导，坚持统筹推进“五位一体”总体布局、协调推进“四个全面”战略布局，坚持稳中求进工作总基调，坚持新发展理念，坚持以供给侧结构性改革为主线，紧紧围绕高质量发展落实赶超，解放思想，开拓创新，继续全面深化改革、全面扩大开放，加快建设富美新漳州，奋力当好新福建建设先锋。全会要求，在更高起点上推动新时代改革开放再出发，要着力优化营商环境，着力全面扩大开放，着力区域协调发展，奋力当好“机制活”的先锋。要突出创新驱动，促进产业融合，强化项目带动，奋力当好“产业优”的先锋。要全力推进乡村振兴，深化社会事业改革创新，加强和创新社会治理，奋力当好“百姓富”的先锋。要持续做好“生态+”文章，加大环境治理力度，强化生态文明考核，奋力当好“生态美”的先锋。要坚持把党的政治建设摆在首位，深化党的建设制度改革，推进民主法制领域改革，毫不动摇加强党的全面领导。全会强调，全市各级各部门要更加解放思想，更加勇于担当，更加求真务实，更加凝心聚力，努力推动改革不停顿、开放不止步。全会号召，全市各级党组织和广大党员干部群众要更加紧密地团结在以习近平同志为核心的党中央周围，深入学习贯彻习近平新时代中国特色社会主义思想，不忘初心、牢记使命，解放思想、锐意进取，坚定不移将改革开放进行到底，为加快建设富美新漳州、当好新福建建设先锋作出新的更大贡献！
24,漳州消防救援支队举行迎旗授衔和换装仪式,2018-12-29,2018-12-29,漳州日报,https://www.zhangzhou.gov.cn/cms/html/zzsrmzf/2018-12-29/1966907082.html,市领导指出，长期以来，全市消防救援队伍把服务保障地方发展视为己任，将爱民护漳内植于心、外化于行，时刻听从党和人民召唤，为保护人民群众生命财产安全、建设富美新漳州作出了重要贡献。市领导强调，组建综合消防救援队伍是党中央、国务院作出的重大决策部署，是以习近平同志为核心的党中央立足我国国情和灾害事故特点，构建新时代国家应急救援体系的重要举措。希望全体消防救援指战员坚决拥护、坚决服从、坚决执行，牢记“对党忠诚、纪律严明、赴汤蹈火、竭诚为民”训词要求，始终坚持党对消防救援队伍的绝对领导，坚定立场，听党指挥，做到绝对忠诚、绝对纯洁、绝对可靠。要始终坚持纪律部队建设标准，按纲建队、依规管队，服从命令、听从指挥，用铁的纪律打造铁的队伍。要始终坚持英勇顽强、不怕牺牲的战斗作风，召之即来，战之必胜。要始终坚持以人民为中心的发展思想，为维护人民群众生命财产安全而英勇奋斗。（记者 张志鹏）
25,“黄道周奖”第一届海峡两岸书法作品展开幕,2018-12-29,2018-12-29,漳州日报,https://www.zhangzhou.gov.cn/cms/html/zzsrmzf/2018-12-29/1988725608.html,
26,落实全面从严治党主体责任集体谈话会召开,2018-12-29,2018-12-29,漳州日报,https://www.zhangzhou.gov.cn/cms/siteresource/article.shtml?id=60451949398390004&siteId=620416811908440000,会议指出，市直政法系统、台港澳办、信访局及团市委、妇联、残联、科协、计生协等单位党委（党组）要知责明责、尽责负责、考责问责，有力有效管好班子、带好队伍。尤其要深入学习贯彻习近平总书记在庆祝改革开放40周年大会上重要讲话精神，准确把握“办好中国的事，关键在党，关键在党要管党、全面从严治党”的部署要求，对本系统、本单位落实全面从严治党主体责任再压实、再深化，对领导班子及其成员廉政建设再提醒、再督促，坚定不移推动全面从严治党向纵深发展。会议要求，要坚持站位全局，旗帜鲜明讲政治；坚持以上率下，勇于担当扛责任；坚持抓常抓细，驰而不息纠“四风”；坚持严抓严管，标本兼治抓廉政，切实做到从严治党不放松、正风肃纪不止步、惩治腐败不手软，全力营造风清气正的政治生态。会上，市委政法委、市公安局、台港澳办、妇联等单位党委（党组）就落实全面从严治党主体责任作交流发言，驻市委政法委纪检组作典型经验介绍，各县（市、区）、开发区分管政法领导参加会议。（记者 李润）
27,檀云坤刘远调研西院湖建设,2018-12-29,2018-12-29,漳州日报,https://www.zhangzhou.gov.cn/cms/html/zzsrmzf/2018-12-29/1520383562.html,今年以来，在芗城区和漳州城投集团的共同努力之下，西院湖生态园二期仅用8个月的时间便建成完工，2019年元旦将正式面向市民开放。漫步园内，一期二期湖体贯通连为一体、碧波潋滟，枕月桥一弯如月、曲线柔美，五彩花团、芳草绿树与闽南古厝相互点缀、彼此衬托，处处美不胜收。檀云坤、刘远边走边看，与群众亲切交流，与有关部门单位负责人商议交谈，充分肯定项目建设成效，对大家的用心和辛苦付出表示衷心感谢。市领导指出，细节决定成败、用心方能做好，要继续完善提升每一处细节、每一个节点，持续优化配套服务功能，把西院湖项目打造得更美更好更优。要始终坚持自然生态理念，着力提升整体绿化美化水平，在道路两侧加密补植成规模、树冠大、会开花的乔木，不断做优生态环境，真正实现“夏有荫凉”。要打造开敞空间，加快拆除有碍空间开放的围墙建筑等，使西区污水处理厂、西院体育空间等与西院湖生态景致融为一体、相互协调，切实提升空间利用率和通透感。要按照“大旅游”标准，进一步完善休闲长椅、环湖步道、夜景照明等服务设施，不断满足群众对美好生活的向往；统筹谋划建好西院湖与安居小区、“芗江水岸、龙江观竹”之间的飘带天桥，着力实现区域连片无障碍畅通连接。要持续延展“生态+”效益，合理布局酒店、写字楼等服务业项目，把产业、文化、服务加进去，推动“生态+”往深里做、往实里做、往优里做，让城市更宜业、更宜游、更宜居。市领导张琳光、张慧德等参加调研。（记者 苏雄锋）
28,檀云坤主持召开市委常委会会议,2018-12-29,2018-12-29,漳州日报,https://www.zhangzhou.gov.cn/cms/html/zzsrmzf/2018-12-29/568289072.html,
