id,标题,成文或生成日期,发布或生效日期,来源,URL源地址,内容
39,2018中国·漳州国际雕塑艺术展昨日开展,2018-12-31,2018-12-31,漳州日报,https://www.zhangzhou.gov.cn/cms/html/zzsrmzf/2018-12-31/56600309.html,"12月30日，2018中国·漳州国际雕塑艺术展在南山文化生态园正式开展。省住建厅党组成员、副厅长蒋金明为艺术展致辞，漳州市委常委、常务副市长张慧德宣布艺术展开展。

此次雕塑艺术展以“田园都市 生态之城”为主题，由福建省住建厅、漳州市政府共同主办，漳州市住房和城乡建设局、漳州高新区管委会联合承办，漳州城投集团协办，旨在响应习近平总书记倡导的“绿水青山就是金山银山”绿色发展理念，彰显花样漳州“绿城、花城、水城、历史文化名城”的独特魅力。

漳州市委市政府高度重视此次雕塑艺术展，着力筹划部署，在短短1个月的时间中从世界70多个国家和地区（含中国港澳台地区）征集了3211件（组）作品，并用时8个月成功实现最终获选的46件优秀雕塑作品全部落地，数量之多、速度之快、质量之好、群众反响之热烈，均位列全省历届城市雕塑艺术展之首。展览的成功举办，不仅为城市增加了一道亮丽的风景线，更极大提升了广大市民的获得感和幸福感。

当天，随着雕塑艺术展正式开展，沿南湖畔漳州国际雕塑园景观步道草坪构建出的“生态+”艺术文化角也同步开放，未来这里将举办更多精彩的国际文化艺术交流活动，向市民呈现出更丰富的雕塑艺术成果，通过为文化“搭”台、为生态“塑”魂，扩大漳州在国内外的影响力，促进漳州城市的公共空间艺术与绿色生态的融合发展。（记者 蔡柳楠）"
40,中国食品名城（漳州）食品交易会开馆,2018-12-31,2018-12-31,漳州日报,https://www.zhangzhou.gov.cn/cms/html/zzsrmzf/2018-12-31/1679722665.html,"●搭建生产企业与省内外经销商、采购商的对接交易平台，现场签约金额13.7亿元








12月30日上午，海峡两岸农产品物流城商贾云集、品牌荟萃，由漳州市人民政府、中国食品报社主办的2018中国食品名城（漳州）食品交易会在这里举行开馆仪式。这是我市首次作为东道主举办的大型全国食品行业盛会。

市长刘远，中国食品报社副社长李红文，副市长陈水树，市食品工业协会会长何红孙，企业家代表马建军共同启动开馆。陈水树在开馆仪式上致辞。市直有关单位和各县（市、区）、开发区（投资区）负责同志，全国各地客商、参展企业代表参加开馆仪式。

食品交易会期间，与会领导嘉宾饶有兴致地参观了展会各展位，与参展企业家、客商等深入交流。市领导指出，本次食品交易会是漳州市委、市政府顺应食品企业界呼声、帮助企业拓展市场、促进产业转型升级的一项重要举措，旨在集中展示漳州名优食品，搭建漳州生产企业与省内外经销商、采购商的对接交易平台，全力打造“永不落幕”的全国性食品交易会品牌。衷心希望借力展会平台，把漳州食品企业的最新产品、最好形象展示出来，推动更多企业“走出去”、接大单，进一步用好惠企政策、拓展销售市场、促进人才交流、深化技术对接，助推漳州食品产业做大做强，努力把漳州“中国食品名城”打造成安全食品名城。漳州热忱期盼与全国各地全面建立长期、稳定的合作关系，开展全方位、深层次、多形式的双向投资和贸易合作，将竭诚为来漳投资兴业的客商提供更加宽松灵活的政策环境和更加优质高效的服务环境。

作为“中国食品名城”，近年来，漳州着力实施食品工业产业提升工程，推动食品工业规模日益壮大、产业链更加成熟、市场竞争力跨越式提升，食品工业成为我市第一大支柱产业，2017年产值超1700亿元。本次交易会坚持政府搭台、企业唱戏，汇聚全市参展食品企业近450家，展示独具特色名优产品3000多种，涵盖罐头、肉制品、果蔬制品、水产品制品、休闲食品、烘焙食品等；同时广发英雄帖，邀请近5000名客商参会，包括杭州百草味、郑州一只狐狸、长沙喜吖吖等来自省外的近2500家重点经销商。

当天，食品交易会还举行了漳州食品工业协会与京东商城、全国经销商专场采购、漳州卖场专场采购、龙海食品企业专场采购等签约活动，现场签约总金额达13.7亿元。（记者 陈岩）"
41,2019年全国社区网络春晚群裕社区分会场开演,2018-12-31,2018-12-31,漳州日报,https://www.zhangzhou.gov.cn/cms/html/zzsrmzf/2018-12-31/1999954206.html,12月28日，2019年全国社区网络春晚福建省漳州市芗城区南坑街道群裕社区分会场在群裕小区上演录制。此次活动是群裕社区第七届社区春晚，9个精选节目一一亮相。快板说唱《扫黑除恶得民心》、群舞《水仙花开迎宾来》、漳州特色大鼓凉伞《鼓舞飞扬》等丰富多彩的节目，全方位展现漳州物产、人情、风情。节目主要由小区居民、社区老人学校和春天义演团参演。社区工作人员全程拍摄活动视频，将参加全国社区网络春晚评选。（见习记者 杨瑞）
42,漳州发布加快实施乡村振兴战略“漳十二条”,2018-12-31,2018-12-31,漳州日报,https://www.zhangzhou.gov.cn/cms/html/zzsrmzf/2018-12-31/202500913.html,近日，漳州市委实施乡村振兴战略领导小组正式对外发布《关于加快实施乡村振兴战略十二条措施的通知》，从产业发展、生态环境、基础设施、乡风文明、公共服务、乡村治理等方面着手，提出12条举措加快美丽、文明、善治、殷实乡村建设，力争漳州乡村振兴在全省走前头、当先锋。在发展特色现代农业方面，我市将积极抓龙头、建基地、强品牌，促进一二三产业融合发展，在稳定粮食生产能力，做强做优做大水果、蔬菜、茶叶、食用菌、水产、畜牧、花卉苗木、林竹、中药材9个优势特色产业的基础上，加大对乡村旅游、乡村物流业的培育力度，形成11个特色优势产业。力争到2022年，实现每个产业全产业链产值均超百亿元，11个产业全产业链新增产值1000亿元以上，总量超过3000亿元。此外，将大力实施特色现代农业“六百工程”，力争到2022年，全市培育100个以上省级以上农业产业化龙头企业，支持建设100个优质农产品标准化示范基地，建成100个农产品产地初加工中心，新增“三品一标”农产品100个，培育“一村一品”特色产业示范村100个，建设100个对台农业合作基地，推动农业高质量发展落实赶超。在深化漳台农业合作交流方面，将加强漳浦、南靖台湾农民创业园以及诏安、云霄、长泰等闽台合作重点县建设，开展漳台农业产业对接升级行动，深化漳台“农业+”旅游、康养、文化、教育、休闲等新型业态的合作。同时，加强漳台特色乡镇、同名同宗村交流，促进两岸同胞情感融合，并鼓励台湾农业人才、建筑师、文化创意团队到我市创业就业，参与美丽乡村建设、传统村落保护、乡村产业培育，承接乡村设计项目，促进漳台乡村产业发展深度融合。在建设美丽宜居村庄方面，我市将实施农村“厕所革命”，合理优化公厕布局，以新建、提档、升级为重点，新建一批、改建一批、提升一批农村公厕，健全公厕日常管理长效机制，进一步提高农村卫生厕所普及率，力争到2020年，全市实现农村卫生厕所全覆盖，同步实施厕所粪污治理。大力实施农村垃圾治理行动、农村污水治理行动、农房整治行动、村容村貌提升行动，力争至2019年底，全市乡镇污水处理设施基本建成并投入使用，各县(市、区)开展5个以上中心村农村村民住宅整治；到2020年，全市完成90%村庄房前屋后整治，农村生活垃圾常态化治理机制更加完善，基本完成非正规垃圾堆放点整治，新建农房建设规范有序，既有农房整治“镇镇有示范”；到2025年，实现全市农村建筑风貌明显改观。在促进乡风文明、健全乡村治理体系方面，我市鼓励传承发展优秀乡土文化特别是红色文化、闽南文化、“海丝”文化、畲族文化等漳州传统文化，持续推进文化科技卫生“三下乡”，加快乡村综合性文化服务中心建设，完善提升农家书屋服务功能，加快推进广播电视村村通向户户通升级，力争每个县(市、区)每年组织开展文化精品进乡村、文化惠民志愿服务等活动10次以上，到2020年基本实现数字广播电视“户户通”。同时，将积极深化村民自治实践，加大农村法治建设，提升农村德治水平，推进乡村“雪亮工程”建设，加快农村综治中心、网格化服务管理平台和立体化社会治安防控体系建设，强化农村群防群治力量，推动基层服务和管理精细化精准化，力争到2020年，示范乡镇(场)、示范村达到新一轮平安示范乡镇、平安示范村创建标准。在人才保障方面，我市将继续深入推行科技特派员制度，实现全市行政村科技特派员和乡镇科技特派员工作站全覆盖，促进科技特派员服务向二三产业拓展。积极引导和支持企业家、专家学者、医生教师等，通过下乡担任志愿者、投资兴业等方式服务乡村振兴事业，允许符合要求的公职人员回乡任职。此外，将切实提高基层干部待遇，乡镇干部经济待遇一般高于县级机关同职级干部10%～20%；村主干基本报酬按不低于当地(以县为单位)农村居民人均可支配收入2倍标准，其他村干部的基本报酬按照村主干基本报酬60%左右的标准。通过推行村“两委”班子成员交叉任职，力争到2022年村党组织书记兼任村委会主任的村比重达50%以上。（记者 蔡柳楠 通讯员 林添晖）
43,我市角美镇和绥安镇入榜中国乡镇综合竞争力百强,2018-12-31,2018-12-31,漳州日报,https://www.zhangzhou.gov.cn/cms/html/zzsrmzf/2018-12-31/1999047063.html,12月27日，中国信息协会信用专业委员会和独立第三方机构竞争力智库在京联合发布了《中国乡镇综合竞争力报告》，揭晓了“中国乡镇综合竞争力百强”榜单，福建4个乡镇上榜，其中，我市龙海市角美镇、漳浦县绥安镇位列其中。据悉，中国乡镇综合竞争力评价的对象为全国公共财政收入前1000位和社会消费品零售总额1000位的乡镇(不含街道)，从经济规模、经济活力、人均水平等三个方面对乡镇综合竞争力进行评价。由于乡镇一级统计基础薄弱、统计制度不健全，大部分乡镇不具备地区生产总值核算条件，同时，为了淡化地区生产总值在评价中的作用，引导各乡镇推进高质量发展，地区生产总值指标未纳入评价体系当中。业内人士表示，该榜单分量十足。中国信息协会信用专业委员会是经民政部批准成立，由国家发改委管理，隶属中国信息协会的专业机构，专门从事信用管理、信用标准、信用服务、信用平台和社会治理研究，服务和引领我国社会信用体系建设，助力中国社会治理转型和经济发展。竞争力智库是专门从事竞争力研究的独立第三方智库，坚持社会责任优先，主要开展国家竞争力、区域竞争力、行业竞争力、企业竞争力研究，社会信用体系建设研究，中国城市全面建成小康社会和基本现代化研究等。（记者 张志鹏）
