id,标题,成文或生成日期,发布或生效日期,来源,URL源地址,内容
342,守护候鸟家园 绿色环境共建设,2018-04-26,2018-04-26,伊春-南岔日报,http://www.nancha.gov.cn/ncxrmzf/c100689/201804/70176.shtml,为传播生态文明理念，树立“爱鸟护鸟，从我做起”的社会新风尚，南岔区第一中学开展了以“绿水青山、让鸟儿自由飞翔”为主题的爱鸟护鸟系列教育活动。     我校以宣读“爱鸟护鸟”倡议书拉开序幕，举办“绿水青山让鸟儿自由飞翔”征文书画展。   通过征集书画和征文的方式，使爱鸟护鸟的的积极意义呈现在同学们一幅幅小作品中，更展示了他们对鸟儿对家乡及对大自然的热爱和对爱护鸟类的期盼。   此次爱鸟护鸟系列活动不仅提高了广大师生对鸟类、生态、环境的认识，还让全体学生明白：由于经济利益所驱动，偷猎候鸟行为屡禁不止，保护候鸟任重道远。
343,搭建交流平台 资源成果共享,2018-04-26,2018-04-26,伊春-南岔日报,http://www.nancha.gov.cn/ncxrmzf/c100689/201804/70175.shtml,2018年4月24日上午，在区教育局教研室组织下，我校开展了以“凝心聚力，促高效课堂”为主题的“数学学科校际开放日”活动。举办此活动的目的是为了共同提升教育教学质量，探索实施高效课堂的途径与方法。前来参加的有区教育局领导、教研员及兄弟学校的教师。   首先是我校数学教研团队的两位教师作课，孙丹丹老师执教的是七年级下《消元法解二元一次方程组》，张淑波老师执教的是八年级下《菱形的性质》，她们的教学理念都是以新课改为指导，创设生动教学语言环境，激发学生学习的热情和兴趣，充分利用小组合作探究极大地调动学生积极性，教师适时点拨引导，凸显学生的主题地位，做到师生互动、生生互动，教学效果不错。   然后由我校教导处副主任李博代表数学教研团队详细地介绍了学校的教育教学及课改情况，接下来由团队孙捍梅和林桂芳两位教师分别做反思性课例汇报，各学校老师代表评课，我校两位作课老师针对大家点评做统一答疑。   最后区数学教研员刘兴文围绕本次活动对两节数学课进行精彩点评，并提出许多中肯宝贵的建议，教研主任周玉琴提出要多研究核心素养指导下的数学教学，为我校今后数学教研指明方向。   此次“数学学科校际开放日”活动给教师们提供了一次宝贵的学习机会，极大地调动教师的学习热情，也促进我校教师的教研能力和课堂教学水平的提高，为今后提高学校教学质量提供了保障。
344,南岔四中召开中考前60天冲刺誓师大会,2018-04-25,2018-04-25,伊春-南岔日报,http://www.nancha.gov.cn/ncxrmzf/c100689/201804/70172.shtml,为增强初三学生迎战中考的信心，激发其顽强拼搏的精神，以良好的心态投入到中考中，2018年4月23日下午，在会议室隆重举行了2018届中考冲刺誓师大会。   誓师大会上，徐校长作了热情洋溢的动员报告，号召全体师生以饱满的热情，昂扬的斗志，刻苦的精神，坚韧的毅力，满怀信心，夺取2018年中考的全面胜利。   在宣誓中，初三学子以铿锵的誓言，表示要以坚强的斗志，刻苦的精神，科学的方法奋斗60天，以优异成绩不负父母的期盼，不负恩师的厚望，不负学校的期望，不负青春的梦想。   本次誓师大会的召开，极大地鼓舞了全体初三师生的斗志，坚定了备考的信心，调动起了学生的学习主动性，营造了浓厚的备考氛围，为初三最后的冲刺复习打下了良好的基础。
345,重拳出击 扫黑除恶,2018-04-25,2018-04-25,伊春-南岔日报,http://www.nancha.gov.cn/ncxrmzf/c100689/201804/70169.shtml,为深入贯彻落实4月19日全省扫黑除恶专项斗争视频调度会议精神，扎实推进全局扫黑除恶专项斗争的顺利开展，4月23日下午，南岔公安分局召开科所队长会议，对专项斗争重点工作进行再部署。会议由分局党委委员、常务副局长毕东学主持，分局党委书记、局长杨晓宇出席会议并作重要讲话，在局领导班子成员、各科所队长参加会议。   会上，各参战部门汇报了前期宣传发动、调查摸底和线索排查等工作情况，杨晓宇局长亲自做了点评，指出了工作中存在的问题，提出了下步指导意见。杨晓宇局长在讲话中，就提高思想认识、强化线索摸排、研究工作方法、加强业务学习、严格正风肃纪、落实督导考核等进行了专门部署。   按照压实专项斗争责任，落实一级对一级负责、层层签订责任状的工作要求，分局主要领导与战线副局长、战线副局长与科所队长代表在会上签订责任状，会后各科所队队长与民警签订责任状。
346,南岔区举办第八届“林都情韵”“阅读开启智慧人生”诵读比赛,2018-04-24,2018-04-24,伊春-南岔日报,http://www.nancha.gov.cn/ncxrmzf/c100689/201804/70166.shtml,4月20日下午，中共南岔区委宣传部、区教育局和区图书馆联合举办了南岔区第八届“林都情韵”——“阅读开启智慧人生”诵读比赛活动。   参加本次大赛的领导有：区委常委宣传部长乔洪生，副区长马淑红，政协副主席赵秋义。   比赛在区机关二楼会议室举行，12位参赛选手均是在中小学校初赛的基础上选拔上来的优秀学生。比赛前，12位选手亲自抽签，整个赛场秩序井然。比赛中，选手们以感人生动的语言、全情投入的神态、灵活自然的动作，充分表达了对家乡的热爱和赞美之情，选手们富有感染力的精彩表现打动了评委和观赛师生，博得阵阵掌声，充分展示了我区中小学生优良品质和积极向上的精神风貌。经过激烈比拼，本次比赛评委组从演讲内容、语言表达、形象风度、整体效果等方面对参赛选手的演讲进行了打分评选，产生了一等奖一名、二等奖三名、三等奖三名以及优秀奖五名，与会领导为获奖选手们颁发了奖状和奖品。   此次比赛，不仅使同学们在活动中得到了展现自我风采和锻炼提高的好机会，而且加深了同学们对家乡的了解和热爱。
347,月明帮扶工作队入村商讨黄芪种植,2018-04-24,2018-04-24,伊春-南岔日报,http://www.nancha.gov.cn/ncxrmzf/c100689/201804/70164.shtml,2018年4月22日，由于威岭渡口河水没有彻底融化，所以月明帮扶工作队一行成员坐早晨5点的火车到达月明村进行入户走访。   首先工作队成员与驻村第一书记及村两委干部交流，针对村内贫困户的项目开展、平榛树栽种、黄芪种植地址等事宜进行了进一步商谈，达成共识。接着工作队成员入户调查每户禽类养殖数量并记录，近期会把禽类种仔送到贫困户手中。   让人感动的是本村种植技术顾问邵传友不计成本，挖出自家两年生黄芪逐户进行贫困户入户宣传，让每户都认可黄芪种植、信任工作队，让大家切身体会到工作队所做的一切都是为了全体贫困户，感受到区政府的温暖。
348,南岔区学习贯彻中央巡视工作规划精神重新修订区委巡察规划推动巡察工作向纵深发展,2018-04-24,2018-04-24,伊春-南岔日报,http://www.nancha.gov.cn/ncxrmzf/c100689/201804/70163.shtml,4月17日，南岔区委召开区委常委会，在4月10日区委理论中心组传达学习《中央巡视工作规划（2018—2022年）》精神基础上，研究通过《二十届南岔区委巡察工作规划（2017-2021年）》（以下简称《规划》）修改意见。区委书记李纯厚主持会议。   《规划》依据《中央巡视工作规划（2018-2022年）》，对指导思想、总体目标、基本原则、工作方针、深化政治巡察具体要求、建立巡察上下联动的监督网进行重新修改完善，结合实际，对二十届区委5年巡察工作作出新安排，并从加强组织领导、创新巡察方式、强化队伍建设、强化整改和成果运用四个方面加以保障。   会议指出，《中央巡视工作规划（2018—2022年）》深入贯彻党章和党的十九大精神，全面总结了党的十八大以来巡视工作成功经验，集中体现了以习近平同志为核心的党中央关于巡视工作的新部署新要求，明确了今后5年巡视工作的总体要求、目标任务和思路举措，是巩固深化发展巡视巡察工作的重要指导性文件，对推动全面从严治党向纵深发展具有重要的政治意义、理论意义和实践意义。全区各部门各单位要提高政治站位，牢固树立“四个意识”，深刻认识巡视巡察工作重大意义，切实把思想和行动统一到中央精神上来；要创新巡察方式，围绕政治建设、思想建设、组织建设、作风建设、纪律建设和夺取反腐败斗争压倒性胜利，深化政治巡察，加大整治群众身边不正之风和腐败问题力度，把利剑直插农村、社区基层，打通全面从严治党“最后一公里”；要强化巡察干部队伍政治建设、能力建设、作风建设，从严监督管理，建设一支让党放心、人民信赖的高素质专业化巡察队伍。   会议强调，要紧密结合当前工作实际，针对群众反映强烈的热点难点问题，开展扶贫领域和深化干部作风整顿优化营商环境专项巡察，从严从细发现问题线索，重拳治理窗口服务突出问题，坚决惩处“蝇贪”和“微腐败”，形成强大的威慑效应，推动巡察工作向纵深发展，为打赢脱贫攻坚战和深化干部作风整顿优化营商环境提供坚强保障。
349,南岔公安分局治安大队开展法律宣传活动,2018-04-23,2018-04-23,伊春-南岔日报,http://www.nancha.gov.cn/ncxrmzf/c100689/201804/70161.shtml,按照南岔公安分局党委部署，2018年4月19日上午南岔治安大队全体民警及特警队员开展了《南岔区反恐怖普法宣传》、《依法禁毒构建和谐》、《平安南岔爱护铁路》法律宣传活动。   活动中治安大队全体通过向群众发放宣传材料、现场讲解、接受群众咨询等方式进行宣传。现场向群众发放了《预防恐怖活动行为指引》、讲解了什么是恐怖主义、恐怖活动及恐怖袭击的方式、特点等方面内容，使广大人民群众提高了对恐怖活动知识的了解，告知群众在日常生活中购票乘坐交通工具要积极配合安检、使用物流快递、旅店住宿等要依法实名登记等注意事项。   此次宣传活动治安大队出动警力18人、防爆车辆一台，发放宣传资料100余份，接待咨询群众30余人。通过此次宣传活动，进一步密切了警民关系，提高了群众的反恐意识、增强了自我防范意识和自救互救技能，自觉抵制恐怖主义思想，正确识别、举报涉恐可疑情况，为构建平安南岔奠定了坚实基础。
350,南岔四中开展“三清一绿”志愿者环境维护活动,2018-04-23,2018-04-23,伊春-南岔日报,http://www.nancha.gov.cn/ncxrmzf/c100689/201804/70160.shtml,为迎接第30个全国爱卫宣传月，4月16日，南岔区第四中学组织全体学生及党员干部集中开展“三清一绿”志愿者环境维护活动。   活动中重点清理学校围墙一侧的排水沟及校园内卫生死角中的塑料袋、塑料餐盒等白色垃圾。同时向居民进行环保宣传，让大家了解环保的重要性，呼吁大家保护环境“从小事做起，从身边做起，从你我做起”。本次活动共清理各类垃圾两车，排水沟50米。活动得到社区居民的支持和认同。清理垃圾过程中发现校门附近一通讯井盖被车压翻，我们及时将其安放好，消除了行人安全隐患。   通过此次活动，不仅向广大群众广泛宣传生态环保理念和知识，增强了群众爱护环境、爱护生态的自觉性，也提高了广大师生的使命感和义务感，唤醒人们爱护环境的意识，让环保的思想深入每一个人的心中。
351,善待地球 绿色责任,2018-04-23,2018-04-23,伊春-南岔日报,http://www.nancha.gov.cn/ncxrmzf/c100689/201804/70158.shtml,4月22日是世界地球日，地球是我们唯一的家园，为了提高幼儿爱护环境、保护地球的意识，浩良河小学幼儿园于4月20日开展了“善待地球，从小做起”系列活动。   活动中，大班的小朋友则负责督促家长尽量使用无污染的交通工具来园，避免汽车尾气对环境的污染。中班的小朋友同老师一起制作环保卡，唤起人们共同参与到环保中来，用实际行动善待地球。小班通过我是小小清洁工的形式，让幼儿了解世界地球日的基本知识，知道保护地球的重要性。同时，我园还将“善待地球，从小做起”的行为贯穿到幼儿的一日生活中，如洗手时要及时关闭水龙头，垃圾不落地，保护幼儿园的花草树木等。   通过本次活动，不仅让幼儿了解了环境与我们生存的关系，更重要的是教育幼儿们懂得珍爱地球。让爱护环境从每个人身边的小事做起，让我们拥有更多的蓝天、白云、绿地。
352,伊春市质监局南岔分局积极推进“春雷行动”深入开展,2018-04-23,2018-04-23,伊春-南岔日报,http://www.nancha.gov.cn/ncxrmzf/c100689/201804/70156.shtml,4月17日，为充分发挥技术职能部门作用，切实保护农民利益，促进农民增产增收，创造健康的农资购销环境。伊春市质监局南岔分局以服务“三农”、保春耕为主组成专项小组，对辖区内各个农资用品店进行了检查。共检查农资用品店7家、出动工作人员21人次，现场检定计量器具11台，并对农资产品定量包装情况进行了抽检。工作人员还积极向商户和现场农户宣传计量器具免费检定的政策情况，得到了百姓的一致好评。   下一步，南岔质监分局将深入到田间地头、农民身边持续扩大“春雷行动”的宣传面和覆盖面，现场为种植户宣传讲解肥料、农资真假的辨别，力争提高农民对农资真假辨别能力，真正将“春雷行动”的惠农政策落实到户。
353,南岔区教育局开展规范办学行为推进教学常规检查工作,2018-04-23,2018-04-23,伊春-南岔日报,http://www.nancha.gov.cn/ncxrmzf/c100689/201804/70154.shtml,为进一步推进教育系统深化干部作风整顿、优化营商环境工作，加强全区学校教育教学常规管理，规范学校及幼儿园的办学行为，保证教育教学活动有序开展，4月9日——4月18日，南岔区教育局教学常规检查组在督导室主任仇永蛟的带领下，对全区7所中小学和4所幼儿园进行教育教学常规检查。   检查组采取“听、查、看”等方式对各中小学及幼儿园课程设置、教师备课、课堂教学、教学反思、作业布置及德育、后勤等方面工作进行了认真细致的指导和说明，有效发挥了教育行政部门的服务作用。   在反馈会上，仇主任充分肯定了各中小学及幼儿园的各项常规工作，校园文化、环境创设均体现了内涵和特色，安全、后勤、保健工作做得扎实、细致，各类档案资料齐全，教学常规工作管理有序，教研工作开展深入。肯定成绩的同时，也提出了合理化的意见和建议，比如加强学校党建工作，加强对十九大精神，特别是教育各类政策法规的学习，继续深入开展弘扬中华优秀传统文化主题活动，有效提高各实验室的使用率，课堂上进一步培育学生核心素养，培养学生实践能力和创新能力等。   此次活动，进一步明确了我区教学常规工作目标，对我区的教育教学工作起到了很好的监督和激励作用。
354,南岔林业局职工医院院召开关于用药的医保政策和要求会议,2018-04-23,2018-04-23,伊春-南岔日报,http://www.nancha.gov.cn/ncxrmzf/c100689/201804/70106.shtml,针对上级医保部门下发的“伊春市两个定点”和“全省定点医疗机构专项检查”的通知，关勇院长做出特别指示：第一要彻底完善医保相关政策和管理制度，让我们在以后的工作学习中，有据可依，有章可循。并下发经李院长审核过的相关文件资料。第二就是要高度重视此次“专项检查”，并以此为契机，在以后的日常工作中始终如一的坚持执行。   此次专项检查的主要内容包括就医患者冒名顶替、串换项目、虚开项目；重复、分解、过度、超限制范围诊疗；挂床住院等。此次会议也提醒各相关人员认真对待，切实履行。
355,创建和谐社会打造平安南岔,2018-04-23,2018-04-23,伊春-南岔日报,http://www.nancha.gov.cn/ncxrmzf/c100689/201804/70105.shtml,为进一步提升广大居民群众反恐防恐、禁毒防毒、爱路护路意识，结合我区处于铁路沿线城区特点，4月19日由区综治办牵头协同铁路护路办、区公安分局反恐大队、区公安分局禁毒大队开展了以反恐、禁毒、爱路护路为主题的宣传教育活动。   宣传活动中，通过设立宣传台、摆放展板、悬挂宣传横幅、发放宣传手册、宣传单等方式，向过往群众讲解现阶段的反恐形势和如何应对恐怖袭击，保护自身安全的知识，讲解过程中工作人员针对铁路沿线居民如何预防恐怖事件发生做了重点介绍，让群众真正了解、掌握如何防范、制止违法犯罪行为，极大的提升了群众安全意识。禁毒大队通过播放宣传片深刻的描述了毒品给人们带来的危害，让群众更加坚定的拒绝毒品，远离毒品。现场气氛活跃，群众认真阅读展板及宣传资料，大家纷纷表示：“类似这样的宣传要经常性的开展，可以有效提高防范意识，保障人身、财产不受不法分子侵害。”   此次宣传共开展两天时间，现场共发放宣传资料800余份，接受群众咨询200余次，宣传活动收到良好的效果，进一步提高了群众的禁毒、防毒、反恐防恐、爱路护路意识，为打造平安南岔、构建和谐社会打下坚实基础。
356,南岔区高度重视春防工作,2018-04-23,2018-04-23,伊春-南岔日报,http://www.nancha.gov.cn/ncxrmzf/c100689/201804/70103.shtml,图为岩石所道口固定岗防火员正在检查过往车辆   南岔区将春防工作作为当前工作首要任务，全面强化火源管理工作，加大重点入山路口的固定岗、流动哨巡护检查力度，严格执行入山检查登记，对过往人员和机动车辆进行登记造册，防止失控火源流入造成灾害。
357,“群众办事百项堵点疏解行动”，面向社会公开征集群众办事堵点难点问题,2018-04-23,2018-04-23,伊春-南岔日报,http://toupiao.www.gov.cn/100dudian/index.htm,
358,市公安局党委委员、副局长赵龙新到南岔分局调研指导派出所整合工作,2018-04-20,2018-04-20,伊春-南岔日报,http://www.nancha.gov.cn/ncxrmzf/c100689/201804/70096.shtml,为迅速贯彻落实4月17日市公安局党委会议精神，深化派出所规范化建设，加快整合步伐，扎实推进一级派出所建设进程，4月18日下午，市公安局党委委员、副局长赵龙新率户政支队长王刚、副支队长李鹏到南岔分局调研指导工作。南岔公安分局党委书记、局长杨晓宇携班子成员及相关部门负责同志陪同调研。   赵龙新副局长首先召开座谈交流会，传达市公安局党委会议精神。他在讲话中强调：按照年初重点工作目标确定的逐步对中心派出所进行整合，建成一级中心派出所，其他派出所作为警务室管理，打造“一个中心、多点支撑”的布局要求，南岔分局作为全市社会治安情况较为复杂、人口较多、辖区面积较大的区局，必须主动作为，积极适应改革发展新模式，科学谋划，合理布局，优化配置，进一步统筹整合派出所的警力资源，切实提升派出所规范化建设水平，最大限度地发挥基层警务工作效能。杨晓宇局长在座谈交流时表示：全市公安工作会议后，南岔分局立即着手派出所整合工作，在充分调研的基础上，根据地理位置、治安状况、硬件基础等实际，科学选址，谋划调整改造，目前已进入实施阶段。赵龙新副局长在听取南岔分局的整合构想后，对分局把握新要求、瞄准新目标、打造新亮点，做强做精基层基础工作的理念给予充分肯定，并就整合工作实体化运作交流了想法。   座谈交流后，赵龙新副局长一行参观了已建成的现代化网安电子数据取证实验室和在建的新建社区警务室、禁毒教育基地、社区康复戒毒场所，深入一级派出所新址和区址内各派出所进行实地调研，提出指导性意见。
359,南岔区浩良河小学召开班主任工作会议,2018-04-20,2018-04-20,伊春-南岔日报,http://www.nancha.gov.cn/ncxrmzf/c100689/201804/70094.shtml,为了进一步增强班主任工作的使命感和责任感，提高班主任整体素质，进一步增强班级管理工作的针对性和实效性，提高学校德育工作和班级管理水平，4月18日下午，南岔区浩良河小学在学校三楼会议室召开了班主任工作会议。   会上，德育校长于莹肯定了班主任在近期工作中的成绩，同时也指出了近期工作中存在的问题和不足，对班主任工作提出新的要求，接着她又提出了几项重要工作，包括班级卫生、忠孝文化活动、文明习惯、放学安全等等。   接着，政教处彭主任对学生的养成教育和政教处下一阶段重点工作进行了安排，然后与会人员对班级管理工作中存在的困难及下一步工作打算进行亲切的交流和探讨。   这次班主任工作会议，既布置了下阶段的工作任务，更对班主任的管理方式指明了方向，为学校德育工作的顺利开展奠定了坚实的基础。
360,南岔区委书记李纯厚深入窗口服务部门实地调研检查工作,2018-04-20,2018-04-20,伊春-南岔日报,http://www.nancha.gov.cn/ncxrmzf/c100689/201804/70092.shtml,在南岔区深化干部作风整顿优化营商环境大会召开后的第二天，区委书记李纯厚就贯彻落实深化作风整顿优化营商环境和整治窗口服务突出问题等工作，轻车简从，采取不打招呼、不定时间、不定具体单位等方式，深入到区行政服务大厅和民政、社区、国税、地税、工商、国土、交警等8个窗口服务部门实地检查工作纪律，调研窗口服务工作。   在行政服务大厅，李纯厚先后到热力、物业、自来水、人社、社保、就业和档案等办事服务窗口和办公室，检查了机关工作纪律、窗口人员在岗及现场办公情况，详细查看了办事流程。对服务大厅建设、内设机构、部门分配等问题现场研究、作出指导，对服务还不够优化的窗口单位，当场提出整改意见，要求各单位予以改进解决。   在国税、地税和工商分局，李纯厚查看了企业申报单据，并与相关企业办事人员围绕窗口服务态度、服务效率等进行了交谈，就审批事项办理流程、受理范围、审核时间听取群众的意见和建议。   在公安交警服务窗口，李纯厚与窗口服务人员进行了交谈，强调要持续改进作风和服务形象，从方便基层、方便群众、方便企业的角度出发，不断简化流程，改进服务态度，让群众和企业“少跑腿”，为我区对外引资和转型发展提供一流的服务保障。   李纯厚在检查调研中，看到去年干部作风整顿工作开展以来，所带来的新变化、新气象，以及窗口服务部门工作人员精神饱满的工作状态，对窗口服务部门工作给予充分肯定，并要求各窗口服务部门要切实增强“四个意识”，特别是核心意识、看齐意识，各位干部职工要收心聚力、扬鞭奋蹄、埋头苦干，在平凡岗位创造不平凡的业绩，为推动现代化新伊春南岔篇章的宏伟目标顺利实现作出更大贡献。
