id,标题,成文或生成日期,发布或生效日期,来源,URL源地址,内容
171,干群齐心 重建家园 迎春乡红旗村灾后重建工作有序推进,2018-08-02,2018-08-02,伊春-南岔日报,http://www.nancha.gov.cn/ncxrmzf/c100689/201808/70724.shtml,25日以来，南岔经历了一轮强降雨过程，此次降雨范围大、时间长、雨量多，成灾严重。南岔区委区政府先后启动《南岔区城镇防洪应急预案》二级、三级特别响应，洪水来袭，迅速反应，科学决策，所有领导干部冲锋在前，深入一线，指挥抢险救援工作。迎春乡红旗村出现内涝、积水，道路被毁，房屋损坏、过水等情况。包片处级领导马淑红第一时间查看村民受灾情况，村干部及驻村第一书记到岗到位，在防汛一线，巡查雨情、水情、汛情，时刻与村民联系在一起，共同应对洪水灾情。迎春乡红旗村出现内涝、积水，道路被毁，房屋损坏、过水等情况。包片处级领导马淑红第一时间查看村民受灾情况，村干部及驻村第一书记到岗到位，在防汛一线，巡查雨情、水情、汛情，时刻与村民联系在一起，共同应对洪水灾情。洪水退却后，红旗村干部、驻村第一书记第一时间组织开展灾后自救工作，党员干部全员参与，凝聚力量重建家园。红旗村灾后重建工作主要围绕灾后村民受灾情况详细摸排，灾后卫生防疫，灾后道路、沟渠、房屋抢修、灾后扶贫工作等方面展开。南岔区副区长马淑红同迎春乡乡长、红旗村干部、驻村第一书记、帮扶工作队查看冲毁道路，指导灾后重建工作。贺建梅院长与红旗村干部、驻村第一书记、帮扶工作队挨家挨户深入到困难群众家中，详细了解贫困户受灾情况，详细记录贫困户需求，及时解决贫困户当前遇到的问题，并为贫困户送去面包、安全饮用水等物资，保障贫困户灾后正常生活。水灾过后，环境治理、卫生防疫工作十分重要。红旗村第一时间配合疾控中心做好全村防疫消毒工作，不留死角，并向村民宣传灾后防疫知识。自救自建、不等不靠，红旗村干群一心，灾后积极自救，村干部、驻村第一书记与村民共同修缮受损房屋，疏通沟渠，修补坍塌道路、桥梁，为恢复正常生产生活奠定基础。在区委区政府的坚强领导下，在村干部及驻村第一书记与群众的不懈努力下，迎春乡红旗村已取得了抗洪抢险及灾后重建工作的阶段性胜利，接下来，红旗村全体将按照党和政府的灾后重建工作的进一步指示，努力夺取灾后重建工作的全面胜利。
172,南岔区柳林超市捐助5万元救灾物资,2018-08-02,2018-08-02,伊春-南岔日报,http://www.nancha.gov.cn/ncxrmzf/c100689/201808/70723.shtml,7月25日的强降雨导致南岔区部分地区受灾严重，南岔区柳林超市多处库房进水，造成严重的经济损失。   虽然自身遭受水灾，但全区受灾群众的衣食住行更牵动着柳林超市负责人的心。7月27日，柳林超市负责人将价值5万多元的棉被、豆油、瓶装矿泉水、手纸等救灾物资送到区防汛办，帮助受灾群众渡过难关。   为尽早让灾区群众用上必备的生活用品，7月27日一大早，柳林超市就安排专人准备捐助物资，并在区团委青年志愿者们的帮助下，将捐助的物资送到区防汛办。柳林超市负责人表示，“这些物资是企业对受灾群众的一点心意，也代表了企业对受灾群众的关心与慰问，洪水无情，人间有爱，希望受灾群众能早日恢复正常的生产生活，早日重建家园。”
173,浩良河镇干部群众齐心协力开展灾后自救,2018-08-02,2018-08-02,伊春-南岔日报,http://www.nancha.gov.cn/ncxrmzf/c100689/201808/70722.shtml,灾害无情人有情，7.25洪灾发生后，浩良河镇党委、政府不等不靠，第一时间组织各包村干部、第一书记、村干部与党员群众一同开展恢复生产工作，坚决打赢灾后恢复生产自救战。   组织村民对冲毁路面进行抢修，安排铲车等大型机械，对河堤、路基进行清理修复，对各村主要街道柴草、垃圾等进行清理，修缮漏雨和被洪水漫过的房屋，确保村民住行安全。   排查修复被毁农田、鱼池、道路和水利设施，排抢洼地积水，防止再次强降雨造成的二次损毁。对大河浮桥进行固定，防止浮桥冲击铁路桥梁，造成重大事故。   做好灾后防疫工作，利用微信公众平台等方式宣传卫生防疫知识，与南岔区卫生局联系及时对洪水漫过的公路、街道、民房院落、垃圾临时堆放点、牲畜圈进行消毒防疫，确保灾后无疫情。   及时安排受灾人员的住宿、饮食、用水、医疗工作，确保受灾群众有地方住、有饭吃、有干净水喝、有病能及时得到医治。   组织包村干部、驻村工作队、第一书记进行入户排查，对各村受灾情况及时进行统计和上报。   目前，全镇各行政村灾后恢复工作正有条不紊地开展，受灾群众生产生活逐步步入正轨。
174,南岔区纪委监委“八一”前夕走访慰问区人武部官兵,2018-08-02,2018-08-02,伊春-南岔日报,http://www.nancha.gov.cn/ncxrmzf/c100689/201808/70721.shtml,在“八一”建军节即将到来之际，南岔区纪委监委班子成员到区人武部开展走访慰问活动，共同庆祝中国人民解放军建军91周年。   慰问中，区纪委监委一行人对驻区官兵们长期以来牢记服务人民的宗旨，把驻地当作第二故乡，积极投身地方经济社会建设，特别是在抢险救灾和军民共建等实践中奋勇争先、无私奉献，以实际行动为民造福，作出的重大贡献表示感谢。同时，详细询问了官兵工作、生活情况，为区人武部官兵送去了区纪委扶贫项目自产无公害西红柿120斤。南岔区纪委监委希望在今后的工作中，人武部官兵继续坚持和发扬优良作风，一如既往地关心、支持南岔经济和社会发展，军地双方进一步加强交流沟通，互帮互助，真正体现民拥军、军爱民的鱼水深情。通过慰问，纪检监察干部纷纷表示，要坚持学习部队官兵素质过硬、勇于担当、纪律严明的优良作风，促进新时期纪检监察工作再上新台阶。   区人武部政委感谢区纪委监委对人武工作的大力支持，表示今后将认真做好本职工作，坚决按照区委、区政府的安排部署，为奋力谱写现代化新伊春的南岔篇章做出应有贡献。
175,情系困难群体 奉献诚挚爱心,2018-07-31,2018-07-31,伊春-南岔日报,http://www.nancha.gov.cn/ncxrmzf/c100689/201807/70720.shtml,7月28日上午，南岔区柳林家电商店为我区建档立卡贫困人口捐赠价值5000元的厨房电器，以实际行动助力扶贫，展现出了本土企业关爱家乡困难群众的情怀。扶贫办工作人员代为接受了捐赠，受赠物品将由区扶贫开发领导小组作出统一安排。   南岔区柳林家电商店经理袁伟得知我区有上百户贫困人口，生活十分困难，主动与区扶贫办联系，本着“扶贫也是企业的责任”的初心，用自己的力量为我区贫困户奉献爱心，也为我区的企业商家做出了表率。袁伟表示能为南岔区人民尽点绵薄之力，是他及企业热衷的事情，也是回馈家乡的责任所在，以后有机会他还会关注扶贫事业，继续奉献爱心。捐赠仪式于上午10:30分在南岔区同心广场举行，由区委宣传部副部长、统战部常务副部长、工商联党组书记唐志平及扶贫办副主任于莹与袁伟先生对接，接受了捐赠物品。
176,一肩双责 百姓在心,2018-07-31,2018-07-31,伊春-南岔日报,http://www.nancha.gov.cn/ncxrmzf/c100689/201807/70715.shtml,雨季汛期的安全，脱贫攻坚的落实，都是党委、政府的主要职责所在，究其根源，是因为一切都情关百姓的利益，都是各级党委和政府牵挂的事。2018年7月25日，连降大雨，区委书记李纯厚深入到浩良河镇秋冷村、晨明镇宝泉村就防汛工作和扶贫工作进行走访，实地调研。   在秋冷村，李书记实地查看了村医务所、文化活动广场和安全饮水工程建设进展情况。针对安全饮水工程进度缓慢问题，督促浩良河镇党委、政府负责人，要迅速与上级主管部门沟通协调，尽早开工建设。了解到个别贫困户取水距离较远问题，要求浩良河镇党委、政府，驻村工作队、帮扶责任人和村两委，共同协商，尽快拿出实施方案，尽早解决贫困户吃水难问题。在宝泉村，实地查看了文化活动广场建设进展，村医务所建设用地征收和危房改造工作进展情况，明确要求晨明镇党委、政府负责人迅速协调施工方，立即组织开工，争取10日内医务所主体建成。要加快危房改造建设进度，确保主汛期危房不出现任何危险。在两个村子还详细了解了有线电视入户、宽带入户连接、通村主道和巷道路面硬化升级工程进展情况，并对扶贫档案规范填写管理提出了明确要求。   李书记走村入户的同时，全区各级责任包片领导及干部也都迅速到达责任区，切实落实防汛责任，雨不停不离村，保证贫困户的汛期安全，牢记把百姓的利益放在最重要的位置。 李纯厚书记在秋冷村查看广场建设情况 李纯厚书记在宝泉村查看医务所建设征地情况
177,艾林村帮扶工作队开展帮贫困打扫卫生活动,2018-07-31,2018-07-31,伊春-南岔日报,http://www.nancha.gov.cn/ncxrmzf/c100689/201807/70712.shtml,为了深入推进“脱贫攻坚”工作的开展，进一步密切党和群众的关系，经过精心组织，统筹安排，我局于7月15日8时到贫困户关国文家中，帮助贫困户整理房间，打扫卫生，使他们感受到党和政府的温暖。    艾林村工作队及帮扶责任人自备抹布、钢丝球、绿伞、洗衣粉等工具到贫困户的家中帮助贫困户清扫庭院、打扫房屋，并对贫困户家中生活物品摆放进行整理，引导贫困户养成文明健康的生活习惯。在干活的同时，还与贫困户拉家常，鼓励他们坚定改变贫困落后面貌的决心，活动受到了贫困户的一致好评。    至此，工作队已多次到贫困户家中帮扶，并将此活动长期坚持下去，用实际行动改变贫困面貌。
178,南岔区卫计局召开洪灾后卫生防疫工作培训会,2018-07-31,2018-07-31,伊春-南岔日报,http://www.nancha.gov.cn/ncxrmzf/c100689/201807/70711.shtml,7月27日上午9时，区卫计局组织召开了灾后防疫消毒部署落实会议，区疾控、省林业二院、市二院、市三院、区林业医院、区水解医院、区联合和西水社区卫生服务中心等医疗机构负责人以及参加防疫消毒相关人员参加了会议并接受防疫消毒培训。   卫计局主要负责人主持会议并就防疫消毒工作进行了安排部署，首先落实区疾控具体负责并进行业务指导，并成立9支防疫消毒工作队开展防疫消毒工作。   区疾控主任现场培训，重点提出了各防疫消毒工作队要在疾控工作人员指导下开展防疫消毒；同时向灾民发放健康教育知识手册和宣传单，并要将动物尸体集中处理。   培训结束后，各防疫消毒工作队人员整齐着装，带着消毒设备及药物奔赴重灾区域开展工作。
179,市长韩库深入南岔区指导防汛救灾工作,2018-07-27,2018-07-27,伊春-南岔日报,http://www.nancha.gov.cn/ncxrmzf/c100689/201807/70710.shtml,"近日，连续强降雨袭击我市。7月25号，南岔区石头河子林场因山洪导致道路毁损，人员被困、受灾严重。当晚，市长韩库在副市长林宏坤、张国军，市政府秘书长麻昌杰和当地党政领导陪同下，深夜视察灾情、慰问群众。韩库要求，要尽一切力量解救被困群众并妥善安置，确保人民群众生命财产安全。   25号晚，市长韩库得知南岔区灾情后，立即赶往现场视察灾情，并在南岔区召开防汛救灾紧急会议，研究部署救援工作。韩库强调，要切实增强做好防汛抗灾工作的责任感和紧迫感。水务部门的工作人员要全方位24小时不间断做好水位、水情监测观察，时刻掌握河水位涨势情况，要积极做好抢先救灾应急处理等各项工作，进一步增强防范意识，落实工作责任，防汛期间，各有关部门要加强组织领导，高度警戒，不得有一点马虎懈怠，要提高认识，提前制定好防汛防洪预案，做好各项应急准备工作，要时刻观察水位、水情进展，对险情险要部位做好再排查、再部署、再落实，切实保障人民群众生命财产安全。   因石头河子林场部分道路和桥涵被暴雨冲毁，市长韩库一行徒步4公里后乘坐救援车辆于凌晨4点到达石头河子林场，并趟河前往受灾地点看望被困群众，了解灾情和被困人员情况。当得知因一处桥涵被毁，8人被困后，韩库立即前往受灾现场，查看实地情况，和大家研究救援方案。因救援难度较大，需要时间，他首先安排消防官兵空抛水和食物给被困群众，并积极开展救援工作。   当得知石头河子林场上游三公里处养鹿场有一人被困情况紧急，市长韩库一行不辞辛苦，又迅速赶往另一受灾现场实地查看，研究救援方案。并采取利用9米拉梯，架设简易通道的办法，成功解救了被困人员。被困的养鹿职工患有骨股头坏死，行动不便，当看到他没有危险、安然无恙时，韩库非常高兴，他详细询问了养鹿场养殖情况和职工的生产生活情况，并亲自嘱托林场负责人，派专人护送他安全离开受灾地点，妥善安置。   受灾群众杨传华妻子：感动得热泪盈眶，拉着韩市长的手连声感谢，激动地说""共产党好。   市长韩库亲切慰问受灾群众，详细了解他们的受灾情况，询问他们在生产生活中还有哪些困难，需要什么帮助。韩库强调，当地党委政府和场所主要负责人要尽快组织灾后生产自救工作。要加大救助力度，全力保障群众的生产生活。要尽最大力量做好受灾群众安置工作，让他们有地方住、有热饭吃有干净水喝，并积极帮助他们开展灾后自救，尽快恢复正常生产生活，重建家园，让受灾群众切实感受到党和政府的温暖。"
180,省、市局到南岔区开展基建非煤矿山企业安全检查,2018-07-27,2018-07-27,伊春-南岔日报,http://www.nancha.gov.cn/ncxrmzf/c100689/201807/70708.shtml,按照省安监局通知要求，对全省的基建矿山、尾矿库开展安全检查要求，7月23日上午省安监局监管一处王伟处长及非煤矿山专家组一行4人和市安监局监管一科、非煤矿山专家组4人，共计8人来南岔区检查基建矿山、停产停建矿山情况。   首先听取了我区基建非煤矿山工作情况。我区共有在建的，停产停建非煤矿山5户，其中省局批准建设的矿山一户，龙昌矿业公司晨明铁矿。市局批准建设的矿山3户，分别是南岔区8号桥采石场、伊春市石磊矿业、桦阳铁矿。省局王伟处长带领专家组3人，在当地安监局陪同下，深入龙昌矿业公司晨明铁矿，通过现场检查和听取情况汇报，查看现场，发现井口已经被水淹没，四周杂草丛生，厂房办公区荒废无人，没有生产作业迹象。市局检查组先后在桦阳铁矿、桦阳矿业公司尾矿库、八号桥采石场。桦阳铁矿坑下四周长满野草，没有人员走动痕迹，厂房门锁着，没有人员留守。桦阳尾矿库只有一堵墙，已经要坍塌了，一直没有进行建设。南岔区8号桥采石场处于建设期中，石场周边场地已经平整完，其他基础设施正在筹建中。   通过检查后，省局和市局将对一直处于停产停建的晨明铁矿、桦阳铁矿、桦阳尾矿库将进行公告和销号处理，并责成南岔安监局加强对汛期非煤矿山企业的安全监管。落实安全责任制，对易引发山体垮塌等地质灾害的矿山采取相应安全技术措施，有效防范自然灾害引发的生产安全事故。
181,南岔区临危受命显本色日夜奋战展风采,2018-07-26,2018-07-26,伊春-南岔日报,http://www.nancha.gov.cn/ncxrmzf/c100689/201807/70706.shtml,由于近日南岔区普降大到暴雨，局部地区降雨量达到102毫米暴雨导致西南岔河、汤旺河主要河流水位上涨，南岔区多个地区发生严重积水、房屋损毁等紧急情况，危及群众生命财产安全。险情牵动着党员干部和人民群众的心弦，一场与抗洪救灾时间赛跑的战斗已经打响。   南岔区防汛抗旱指挥部于2018年7月25日17时30分启动Ⅲ级应急响应预案。“险情就是冲锋号，灾情就是动员令”。南岔区防火办接到命令后，由党支部书记张运军带领党员干部及大队人员兵分几路迅速赶往受灾地点。党员干部关键时刻冲锋在前、勇挑重担，及时排查隐患，坚持值班值守，积极抢险救灾，冲锋在前，积极奋战，全力以赴投身抢险救灾第一线，用党性保护人民群众的生命财产安全，抵御洪魔守护家园。   抢险救灾工作中，党员干部起到模范带头作用，始终坚守岗位、身先士卒、连续奋战。防火办党员干部及大队人员连续奋战20多小时，有效确保了抢险救灾工作的顺利进行，大水无情，英雄有情！为了保卫一方平安，党员干部永远坚守在人民最需要的岗位上，这是责任，更是担当！谱写了“群众的安危，就是我们的安危。”的忠诚乐章。
182,南岔区委巡察工作领导小组听取第二轮巡察情况汇报,2018-07-26,2018-07-26,伊春-南岔日报,http://www.nancha.gov.cn/ncxrmzf/c100689/201807/70705.shtml,近日，南岔区委巡察工作领导小组召开第七次会议，听取区委第二轮巡察工作情况汇报。区委巡察工作领导小组组长于德海，区委巡察工作领导小组成员、区委组织部副部长、区委巡察办主任参加会议。   会上，区委三个巡察组组长分别从发现被巡察单位党组织存在共性问题、个性问题、反映重点人的问题线索、整改建议等方面，向区委巡察工作领导小组进行了详细汇报。   会议对区委第二轮巡察工作给予了充分肯定，区委巡察组围绕党的政治建设、思想建设、组织建设、作风建设、纪律建设和夺取反腐败斗争压倒性胜利等情况，认真落实区委关于巡察工作的部署，突出深化政治巡察要求，市区联动，完成了对区安监局、原商务局、工信局、教育局、文化广电体育局、资源林政局、专员办、住建局、区环保局、公路办、城市管理行政执法大队等5个党组织11个部门单位常规巡察工作，发现了一批典型问题，巡察工作取得显著成效。   于德海要求，要紧扣政治建设这个根本性建设，以“四个意识”为政治标杆，以党的政治建设为统领，盯住“关键少数”，着力发现党的领导弱化、党的建设缺失、全面从严治党不力，党的观念淡漠、组织涣散、纪律松弛，管党治党宽松软等突出问题，着力查找政治偏差，对全区基层党组织和党员干部进行全面“政治体检”，推进全面从严治党向基层延伸。要统筹推进区委巡察，配合市委做好市区联动、交叉巡察、提级巡察工作，形成“横向到边、纵向到底、市区一盘棋”的巡察监督体系。要善于学习，学好党的十九大精神和习近平总书记系列重要讲话，掌握巡察工作的思想武器和行动指南；要学好巡察工作业务，掌握发现问题的方法技巧，提高发现问题的能力。要加强党性锻炼，强化政治担当，做一名作风过硬、廉洁自律、刚正不阿的巡察干部。要加强整改落实督促指导，确保被巡察单位党组织真正扛起整改政治责任，把各项整改要求落到实处。
183,迎春乡危房改造工作进行时,2018-07-26,2018-07-26,伊春-南岔日报,http://www.nancha.gov.cn/ncxrmzf/c100689/201807/70703.shtml,按照区委、区政府“百日会战”工作的总体部署，南岔区迎春乡将贫困户最为关注，最迫切需要的危房改造工作首先启动。经过包村干部、帮扶责任人入户与贫困户面对面商讨，根据贫困户意愿，因户施策，落实危房改造方式，现已全面铺开了贫困户的危房改造工作。乡政府通过招标确定了施工方，并由乡驻村干部负责监工，确保危房改造按期完工。   近几日，汛情告急，乡里组织人员奋力抗洪救灾，保障农户的安全，但也没有停止危房改造的步伐，坚持只要不下雨，建设就不停。沙山村一组贫困户彭树荣，89岁，妻子87岁，患有慢性病，无劳动能力，今年根据南岔区贫困户危房改造工作方案和本人的要求，为其新建40平的彩钢房屋。现在所看到的新建房屋已基本完成。 彭树荣家新建房屋外部情况彭树荣家新建房屋内部情况
184,齐心协力保平安，抗洪路上齐参战,2018-07-26,2018-07-26,伊春-南岔日报,http://www.nancha.gov.cn/ncxrmzf/c100689/201807/70702.shtml,7月25日，南岔区突降暴雨防汛形势更加严峻，贫困户的安危牵动着区委、区政府、帮扶单位、工作队和帮扶人的心。区委书记、区长亲自挂帅，靠前指挥，奋战在抗洪第一线，帮扶单位派出人员积极参与救援抗洪工作，市驻村帮扶工作队、区帮扶工作队、帮扶责任人、第一书记及村“两委”班子成员也都奋战在村，在贫困户家，他们冒雨奋战，连续工作20小时，不眠不休拼力抗洪，坚守待命。   由乡镇、帮扶工作队、帮扶单位及第一书记组成抗洪小组，根据现场情况，及时组织施工排险。积极帮助低洼地带居住的贫困户转移到安全的学校临时安置点，患病、残疾群众转移安置在镇医院，得到了妥善的安置和照顾。   帮扶工作队、帮扶责任人以及第一书记、村“两委”班子成员都发挥自己的一份光热，为贫困户解燃眉之急。相关部门负责人仍在各村继续坚守岗位，时刻让贫困户感受到党的温暖和关怀。
185,市扶贫办主任段志刚到我区检查指导脱贫攻坚工作,2018-07-26,2018-07-26,伊春-南岔日报,http://www.nancha.gov.cn/ncxrmzf/c100689/201807/70698.shtml,7月23日下午，市扶贫办主任段志刚带领市扶贫办工作人员一行四人，深入到我区调研指导工作。   抵达我区后，首先到区扶贫办检查指导档案规范化建设和管理工作。段主任对村档案、户档案做了规范化要求，也对工作中的不足给出了具体的改进意见，要求把每一个重点问题都详细说明，办公室工作人员做了详细记录，并就工作中的难点问题向段主任做了请示，通过段主任的解答和交流，大家对工作有了更多的思路和方法，感到收获颇多。   7月24日，在区委副书记赵秀东、副区长姜世宏的陪同下市扶贫办工作组深入到我区两镇一乡，走村入户检查指导扶贫工作。段主任分别针对各村的饮水问题以及危房改造问题给出了指导性意见，同时，不辞辛苦，深入到贫困户家中，走访调研，并针对贫困户产业项目问题提出指导性意见，从而也对我区整体脱贫攻坚工作起到了又一次推动和促进作用。我们也将按照市办的指导，认真做好档案内业和基础设施建设等工作，确保“百日会战”取得阶段性成果。
