id,标题,成文或生成日期,发布或生效日期,来源,URL源地址,内容
519,南岔安监局贯彻学习《全市安全生产工作 会议》精神,2018-03-12,2018-03-12,伊春-南岔日报,http://www.nancha.gov.cn/ncxrmzf/c100689/201803/69751.shtml,3月8日上午，伊春市政府召开全市安全生产工作电视电话会议，会议贯彻落实国家、省安全生产工作会议精神，总结了2017年安全生产工作，部署了2018年安全生产重点工作，市安监局局长冯奎阳同志对2017年度安全生产工作进行了通报，明确了2018年主要工作内容，6个部门就做好2018年安全生产工作做了表态发言。市委常委、市政府常务副市长白波做了重要讲话。    会议结束后，南岔安监局立即召开会议，安排部署贯彻落实工作。安监局马胜凯局长传达会议精神并要求，全体人员要认真学习、深刻理解市政府领导讲话精神，立即行动起来，采取有力措施，切实把各项要求和工作部署落到实处。   全力以赴保障全国“两会”这一关键时段的安全稳定，克服松懈麻痹思想，采取超常规措施，有力有效地抓好重点领域安全监管工作，坚决防范和遏制事故发生，确保全区安全生产形势持续平稳向好。
520,南岔区教育局召开专题组织生活会,2018-03-12,2018-03-12,伊春-南岔日报,http://www.nancha.gov.cn/ncxrmzf/c100689/201803/69750.shtml,3月9日下午，区教育局召开专题组织生活会暨民主评议党员大会。会议由局党支部书记、副局长王微同志主持，全体党员出席会议。   会上，王微同志向与会同志作了学习贯彻十九大精神党课报告并代表班子作了对照检查，通报了会前征求意见和建议的情况，然后按照“四讲四有”合格党员标准，坚持问题导向，带头作自我对照检查，其他党员依次开展自我对照检查并开展互评。同时，严格按照党员自评、自我批评、民主测评、组织定评“四评工作法”，深入开展民主评议党员工作。   通过召开支部专题组织生活会，切实开展批评与自我批评，深入开展民主评议党员工作，使全体党员深刻认识到自身的不足与差距，明确了今后的努力方向。区教育局将以此次专题组织生活会为契机，坚持高标准、严要求，以钉钉子精神抓好整改与各项工作落实，推进全区教育工作再上新台阶。
521,南岔区人民法院召开工作会议,2018-03-12,2018-03-12,伊春-南岔日报,http://www.nancha.gov.cn/ncxrmzf/c100689/201803/69749.shtml,3月9日，南岔区人民法院召开2018年工作会议，贯彻落实市政法工作会议和市中级人民法院工作会议精神，总结2017年工作，分析形势任务，安排部署2018年工作。   会议首先传达了全市法院工作会议精神，对院2017年涌现出的先优部门和个人进行了表彰。   院党组书记、院长贺建梅与党组成员和各部门负责人代表签订了《党风廉政建设责任书》。   会议指出，2017年在南岔区委、区政法委和中院党组的坚强领导下，在区人大、区政府、区政协有力监督支持下，紧紧围绕“让人民群众在每一个司法案件中都感受到公平正义”的目标，坚持司法为民、公正司法工作主线，发挥审判职能作用，打击犯罪，化解纠纷，促进发展，各项工作取得了新成效：立足职能发挥，着眼发展大局，全力维护和谐稳定；推进司法改革，落实司法责任，全力保障公正司法；围绕中心工作，加强队伍建设，全力提升履职能力。南岔区人民法院获得全市法院党风廉政建设工作先进集体、全市先进法院殊荣。2名法官获得省高院表彰，刑事审判庭获得市政法委表彰，执行局、浩良河法庭及8名干警获得市中院表彰。   贺建梅院长强调，2018年按照中院提出的“五个抓实，五个新提升”工作任务目标要求，重点做好五个方面工作：一要始终坚持党的领导，加强信念教育；二要推进阳光司法，提升公开效能；三要加强能动司法，服务全区大局；四要提升队伍素质，树立良好形象；五要接受人大监督，改进法院工作。   新形势下的人民法院工作责任重大，使命光荣。2018年南岔区人民法院以习近平新时代中国特色社会主义思想为指导，不忘初心，牢记使命，建设过硬队伍，服务大局，服务地区经济发展，更好地肩负起建设平安伊春、法治伊春的历史重任。
522,南岔区召开2017年度总结述职大会,2018-03-12,2018-03-12,伊春-南岔日报,http://www.nancha.gov.cn/ncxrmzf/c100689/201803/69748.shtml,"3月7日，南岔区召开2017年度总结述职大会。市委第五考核组组长、市委组织部副部长左强出席会议并全程指导。市委第五考核组成员、区委委员、区现职处级领导干部、党政群部门及基层单位主要负责同志等140余人参加了会议。会议由区委书记李纯厚主持。   市委第五考核组组长左强就此次考核工作的重要意义及要求做讲话，他强调要切实提高思想认识，努力营造风清气正的政治生态；要全面把握这次考核的主要任务和特点，明确职责任务、突出考核重点、强化结果运用，确保考出实实在在的成效，全面推进各项工作落到实处。   会上，李纯厚代表区委班子从全面加强和改进党的建设、扎实推进廉政建设和反腐败工作、全面加大经济建设力度、着力改善城乡环境、切实保障和改善民生以及存在的主要问题、下步主要打算和改进措施七方面进行了现场总结述职报告。随后，区委书记李纯厚，区委副书记、区（局）长盛永国还就个人履职情况向大会进行了年度述职述责述廉报告,汇报了个人履职尽责、廉洁从政、作风建设等方面情况。其它处级领导干部以书面形式做了个人年度述职述责述廉报告。   此次考核是全区政治生活中的一件大事，是充分发扬民主，广泛听取各方意见，提高全区工作质量，客观准确地评价领导班子和领导干部的重要举措，更是开启新征程、展现新作为的强大推手。通过考核，南岔区全面了解了过去一年领导班子整体运行和领导干部履职情况，总结成绩、发现不足，对政治生态建设、深入推进全面从严治党、牢固树立“四个意识”、强化正风反腐、增强发展后劲起到了积极作用，更为南岔区经济社会发展建设提供了坚强的组织保障。"
523,追风少年展英豪！——奥运健儿高亭宇荣归家乡,2018-03-12,2018-03-12,伊春-南岔日报,http://www.nancha.gov.cn/ncxrmzf/c100689/201803/69744.shtml,为祖国赢得了荣誉、为家乡增添了光彩，你就要凯旋了！今天，带着平昌冬奥会的征尘，带着勇夺铜牌的光荣，体育健儿高亭宇将在冬奥会后第一次踏上故乡的土地，感受浓浓的乡情和亲情！   3月10日下午，在南岔火车站前举行仪式，隆重欢迎在平昌冬奥会上不负众托，取得优异成绩，续写中国速滑新辉煌的南岔籍体育健儿高亭宇。南岔区委常委、宣传部长乔洪生、副区长马淑红以及教育局长李公宝，体育局长李明杰，东方红小学校长陈长宝等一行人早早就来到火车站前，代表区委区政府和全区人民，向载誉归来的运动员表示热烈祝贺和衷心感谢，希望全区上下认真学习贯彻习近平总书记在会见中国体育代表团全体成员时的重要讲话精神，大力弘扬奥运健儿的拼搏精神，推动南岔体育事业不断取得新的成绩！   随着轰鸣的汽笛声，高亭宇所乘坐的火车缓缓驶入站内。领导们及工作人员已经在站外做好了迎接运动健儿归乡的准备。
524,南岔林业局职工医院组织观看中华人民共和国第十三届全国人民代表大会,2018-03-09,2018-03-09,伊春-南岔日报,http://www.nancha.gov.cn/ncxrmzf/c100689/201803/69742.shtml,2018年3月5日上午9时人民大会堂万人大礼堂气氛庄重热烈，主席台帷幕正中的国徽在鲜艳的红旗映衬下熠熠生辉，近3000名新一届全国人大代表肩负人民重托出席盛会，认真履行宪法和法律赋予的圣神职责。   我院关勇院长组织院职工在会议室的电视机前观看第十三届全国人民代表大会第一次全体会议（开幕会）。认真听取国务院总理李克强关于政府工作的报告：审查国务院关于2017年国民经济和社会发展计划执行情况与2018年国民经济和社会发展计划草案的报告：审查国务院关于2017年中央和地方预算执行情况与2018年中央和地方预算草案的报告：听取全国人大常委会副委员长兼秘书长王晨关于中华人民共和国宪法修正案草案的说明。   观看后我院关勇院长表示要认真学习，深刻领会第十三届全国人民代表大会会议精神，把思想统一到第十三届全国人民代表大会报告精神上来，把认识统一到第十三届全国人民代表大会部署的各项工作上来，结合本职工作进行深入思考，把报告精神转化为指导工作的思路，把报告精神转化为抓质量，保安全，促发展，强质量的实际行动。
525,南岔林业局职工医院推出“三八”妇女节体检优惠活动,2018-03-09,2018-03-09,伊春-南岔日报,http://www.nancha.gov.cn/ncxrmzf/c100689/201803/69741.shtml,3月8日为国际妇女节，随着生活节奏的加快，人们的生活习惯逐渐在改变，越来越多的疾病正向女性走来，并严重威胁着女性的身心健康。我院关勇院长决定与区妇联在“三八”妇女节即将到来之际，为保障妇女身心健康，特推出“三八”妇女节体检优惠活动。   妇女健康体检优惠活动，健康体检项目涵盖面广，价格优惠亲民。此次优惠活动面向社会，促进广大群众对妇女健康的重视，增强老百姓对妇女健康体检的认知。大面积推动广大群众对健康体检的必要性，更科学更健康的生活。
526,南岔区纪委监委坚持“两凡两必” 上好任前廉政“第一课”,2018-03-09,2018-03-09,伊春-南岔日报,http://www.nancha.gov.cn/ncxrmzf/c100689/201803/69740.shtml,为了切实增强新任科级领导干部的纪律和规矩意识，严把领导干部廉洁从政“入口关”。近日，南岔区纪委监委对21名新任职科级领导干部进行了任前廉政谈话和廉政法规知识考试。   南岔区委常委、纪委书记、监委主任于德海同志在考试前对新任职干部进行了集体廉政谈话，要求干部要牢记“千里之堤，溃于蚁穴”的道理，把好廉洁自律关口，始终绷紧廉洁自律这根弦，自觉抵制“四风”隐形变异回潮侵袭，牢固树立正确的“权力观”，坚持严以用权。在新的岗位、新的起点上忠诚履责、廉洁自律，不辜负组织的信任和群众的期盼。   谈话结束后，南岔区纪委监委对新任职干部进行了廉政知识闭卷考试。考试主要围绕习近平总书记关于党风廉政建设和从严治党方面的重要论述、《中国共产党廉洁自律准则》《中国共产党纪律处分条例》及时事政治等内容，重点要求结合本职岗位深度剖析、深度思考，就如何做一名廉洁自律好干部进行深度论述。   通过此次集中谈话与测试，进一步加强了新任职干部遵规守纪意识，筑牢了拒腐防变思想防线。
527,展寒假实践作业 促队员快乐成长,2018-03-08,2018-03-08,伊春-南岔日报,http://www.nancha.gov.cn/ncxrmzf/c100689/201803/69737.shtml,愉快的寒假生活已经结束，为了让每个少先队员度过一个安全、充实、健康、文明的假期，2017年的寒假，南岔区第二中学少先队大队部为孩子们制定了践行尚德教育欢度狗年寒假的活动方案。开学伊始，孩子们带着微笑，带着寒假的收获回到了春意初显的校园，交上了一份令人满意的寒假答卷。   这次寒假活动，大队部分四部分要求学生过一个有意义的寒假。   一是开展尚德活动，奉献一片爱心，争当尚德小标兵。要争当尚德小标兵得从三个方面入手，那就是敬老人，孝父母，爱同伴。孩子们通过送老人礼物，给老人表演节目，通过帮助父母劳动，对父母说感谢等形式向父母回报了恩情;通过为同伴制作贺卡、礼物等形式增进了同伴间的友情。   二是开展实践活动，发扬传统美德。大队部鼓励学生积极参与社会实践活动，争当小小践行家;合理利用压岁钱，争当小小理财家;学会当家作主，争当能干的小管家;开展环保活动，争当环保小卫士。队员们通过照片、写理财经、制作环保作品等形式，认真完成了这项活动。   三是开展读书活动，建设书香家庭。大队部给各个年段推荐了优秀书目，建议全体学生寒假读好书，好读书，争当小小阅读家;一到四年级找爸爸读、找妈妈读，争当书香家庭;五、六年级读书写感受，争当未来小作家。队员们用照片、读后感的形式，充分展现了自己过了一个有意义的寒假。   四是增强自护意识，加强安全教育。制作新年手抄报。要求队员们做到绿色上网;欢度春节;注意安全;文明卫生。   这次活动的展现形式除了发各类奖状外，大队部还把各项资料收集起来，制作成手抄报在学校的文化长廊展出。最特别的是，大队部还将精美的贺卡、礼物、环保作品等收集起来，进行了一次展览，号召全体队员利用中午时间参观各类优秀作品。队员们在欣赏交流的同时，也得到启发，为下一次的寒暑假活动储备了知识和能力。
528,南岔区一中全力以赴打造平安校园,2018-03-08,2018-03-08,伊春-南岔日报,http://www.nancha.gov.cn/ncxrmzf/c100689/201803/69736.shtml,为了进一步加强校园安全防范工作，切实强化校园安全忧患意识，牢固树立“学校安全无小事”的观念。新学期伊始，南岔区第一中学形成了以校领导，值周教师和保安为重点的防护体系，确保学校师生生命财产安全。   开学初学校就安全保卫工作做了统一部署，具体内容包括：严格落实校园安全管理措施，切实加强对校门、校园内重点场所、重点部位、重点时段的安全管理，认真落实校园安全管理和防范工作预案；保安必须按照要求穿着保安制服，能熟练使用各类安保设施器材，熟悉校园监控点位置，熟练操作一键报警系统等，并经常开展突发事件应急演练等活动。尤其在学生每天上学、放学等重点时段，校领导和保安等人员必须等学生安全离校，对学校进行安全检查后方可离校。   相信通过以上工作开展一定能使我校安全工作再上新台阶。
529,尽职尽责当好班主任 扎扎实实做好德育工作,2018-03-08,2018-03-08,伊春-南岔日报,http://www.nancha.gov.cn/ncxrmzf/c100689/201803/69735.shtml,为了提升班主任工作能力，提高班主任整体素质，进一步增强班级管理工作的针对性和实效性，提高学校德育和班级管理水平，3月6日下午，南岔区二中在会议室召开了新学期班主任工作会议。   首先，政教处于主任总结了上学期的班主任工作，指出了班主任工作中存在的问题和不足，重点对班主任工作提出了新学期新要求，其中卫生清扫、课间纪律管理工作是重中之重。最后，邹校长对新学期德育工作做了精心部署并强调了本学期的德育工作重点，同时对班主任工作寄与了更高的期望。   这次班主任工作会议，布置了下阶段的工作任务，为班主任工作指明了方向，必将对今后班主任工作起到积极的推动作用。
530,“幸福课间”丰富学生生活,2018-03-08,2018-03-08,伊春-南岔日报,http://www.nancha.gov.cn/ncxrmzf/c100689/201803/69733.shtml,为培育和践行社会主义核心价值观，弘扬中华优秀传统文化，学校积极组织开展南岔区教育局提出的“弘扬忠孝文化，推进道德教育”活动，利用学校大课间组织开展手语操《三德歌》，让经典在指尖流淌，在美德在歌曲中传承......   教师和学生一起学习，在教师的带动下，学生学习的兴趣深厚，让孩子们在听音乐、做手语操的同时，体会歌曲的内容，学会感恩社会、感恩老师、感恩家长。通过经典《三德歌》手语操让学生学以美德学习经典手语，让学生学以健体。   《三德歌》手语操，师生同乐，形成校园一道靓丽的风景线。
531,“搭建自主成长平台，促进教师技能提升”,2018-03-08,2018-03-08,伊春-南岔日报,http://www.nancha.gov.cn/ncxrmzf/c100689/201803/69731.shtml,“搭建自主成长平台”是浩良河小学在确保教师技能培训高效性方面的一大举措。学校积极为教师营造适宜的环境，提供充分的选择空间，以达到教师内在需要的主动性，形成“自我需要——自主进行——自我完善”的良性循环，从而保证培训的效果。假期，业务校长李艳布置教师完成一幅简笔画、两张钢笔字书法作品、一份读书心得体会等假期作业。   3月7日，教务处组织教师钢笔字、简笔画作品的展示交流活动。首先，教务处人员认真筛选，评出27位教师的钢笔字硬笔书法作品——“秀秀我的钢笔字”，27位教师的简笔画作品——“晒晒我的简笔画”。教务处人员将作品一一粘贴在教学二楼走廊“教师基本功”展板上。作品展出后，吸引了各位教师的目光，广大教师纷纷驻足此处，兴趣盎然欣赏彼此的作品。   今后，我们将以此次展示活动为契机，不断学习，不断探索，不断反思，逐步打造出一支业务素质扎实、业务能力精湛的教师队伍。
532,幸福在身边,2018-03-08,2018-03-08,伊春-南岔日报,http://www.nancha.gov.cn/ncxrmzf/c100689/201803/69729.shtml,在三八妇女节即将到来之际，东方红小学大队部组织全校少先队员以“幸福在身边”为主题，让自己的妈妈、奶奶、老师们度过了一个幸福的节日。   本次活动分为寻找幸福、体验幸福、延续幸福三部分，队员们观察妈妈（奶奶、姥姥）对自己的关爱，从一点一滴的小事中寻找幸福所在，并通过多种方式回报爱，比如一个甜甜的吻，一次热烈拥抱，一声轻轻的“我爱您”，一杯淡淡的热茶……队员与长辈们在亲密接触和相互付出中体验别样的幸福，再一次体现了学校幸福教育的理念。
533,感恩三月情,2018-03-08,2018-03-08,伊春-南岔日报,http://www.nancha.gov.cn/ncxrmzf/c100689/201803/69728.shtml,伴随着春天的脚步，浩良河小学幼儿园的孩子和老师们又迎来了一年一度的“三八妇女节”，这是孩子们向妈妈表达感恩、送上祝福的最好时机。   浩良河幼儿园根据幼儿的年龄特点，开展了以班级为小组的“三八节”系列活动。小班的小朋友用做手指操的方式来表达对妈妈的爱和感激之情；中班的小朋友制作精美的花束贺卡，送上自己最真诚的祝福；大班的小朋友为妈妈制作了光荣花，送一句祝福的话给妈妈，祝妈妈身体健康，节日快乐。这些都表达了幼儿对妈妈的感恩之情。   这次活动的开展，孩子们了解、感知到父母的不容易，学会了关爱和感恩身边的长辈。
534,南岔区教育局学习“16条禁令”和“红七条”文件,2018-03-08,2018-03-08,伊春-南岔日报,http://www.nancha.gov.cn/ncxrmzf/c100689/201803/69725.shtml,3月5日，全体教育局成员在教育局会议室学习《严禁教师违规收受学生及家长礼金等行为的规定》、《严禁中小学校和在职中小学教师有偿补课的规定》、《2018年普通中小学招生入学工作作出部署》的文件精神。   百年大计，教育为本。教育大计，教师为本。加强师德师风教育是全社会关注的热点焦点。通过此次学习，我局全体成员表示会严格遵守国家规定，一如既往的牢固树立教师职业道德规范，在学生心目中树立起教师高尚形象，从而做到“亲其师、信其道”发挥教师对学生的示范、引导作用。
535,南岔区东方红小学开展学雷锋活动,2018-03-08,2018-03-08,伊春-南岔日报,http://www.nancha.gov.cn/ncxrmzf/c100689/201803/69723.shtml,三月是传统的“学雷锋”活动教育月，为传承“奉献、友爱、互助、进步”的雷锋精神，构建文明、和谐的校园，充分展示少先队员的风采，东方红小学在全校开展了“学雷锋、见行动”活动。   3月5日上午，举行了“学雷锋见行动”主题升旗仪式。在鲜艳的五星红旗下，孙校长不仅介绍了我校的小雷锋，还向全体队员发出倡议:倡议队员们学习雷锋的奉献精神，要从我做起，从小事做起；对待身边的同学，要有爱心，热心帮助身边有困难的同学，要热情关心老人和生活不便的人，争当爱心小使者。同时还要学习雷锋的钉子精神，刻苦钻研科学文化知识，争当勤奋好学、勇于创新的好学生。   仪式结束后，辅导员带领红领巾小志愿者们来到东泰嘉园小区，为小区的白色垃圾进行了拾捡，清除了路边的小广告.小志愿者们通过清理卫生，保护环境，来表达对雷锋叔叔的敬意。   通过这次活动，希望队员们能够将“雷锋精神”传承下去，继续弘扬雷锋为人民服务、无私奉献的精神，从小事做起，增强社会责任感和环保意识，努力成为对社会有用的人才。
536,南岔区第二中学举办“学雷锋  树新风”活动,2018-03-08,2018-03-08,伊春-南岔日报,http://www.nancha.gov.cn/ncxrmzf/c100689/201803/69722.shtml,三月是一个春光明媚、生机勃勃的季节，三月更是一个讲文明、树新风，让雷锋精神吹遍校园、吹遍社会每一个角落的季节，在校领导的关怀与支持下，我校开展了以“弘扬雷锋精神，构建和谐校园”为主题的学雷锋系列活动，我们全体师生积极投入到“弘扬雷锋精神”的活动热潮中，在校园内外掀起了一股学雷锋热潮。   3月5日，我校利用升旗仪式的时间组织开展以“雷锋精神”为核心的“文明礼貌月”启动仪式。在仪式上学生们了解雷锋精神的内涵，明确了作为新时代的中学生，对国家和社会肩负的一份责任。同学们举起右手，重温誓词，慷慨激昂。   3月5日，各班积极开展“弘扬雷锋精神”的主题班会活动。通过讨论使学生明白了①什么是雷锋精神②雷锋精神并没有过时。③新时期中小学生应如何向雷锋同志学习？如何用雷锋精神激励自己更好的学习、工作、生活等一系列问题。   为了认真学习雷锋精神，传承雷锋精神，弘扬志愿者精神，我校继续开展了雷锋志愿服务系列活动之“弘扬雷锋精神”黑板报、手抄报展等活动。   同时这些活动也引发了同学们深深的思索：学雷锋是不是真的像社会上流传的那样，只是一阵风，三月来了四月走。他们觉得，雷锋精神应该是和谐文明的社会的一个重要的组成部分，它应该是润物细无声的春雨，滋润每一颗干涸的心田。帮助我们身边每一个需要帮助的人，从我们身边的每一件小事儿做起，就是对雷锋精神最好的继承和传扬。
537,知感恩懂礼孝 好少年献真情,2018-03-08,2018-03-08,伊春-南岔日报,http://www.nancha.gov.cn/ncxrmzf/c100689/201803/69721.shtml,在这大地复苏、春意盎然的美丽三月，为了庆祝“三八妇女节”的到来，深化学校感恩教育，让孩子们懂得感谢父母养育之恩，感谢老师教诲之恩，南岔区第二小学组织开展了“知感恩懂礼孝”的感恩教育系列活动。   活动中，每位少先队员都积极的为妈妈、老师和女性长辈献上一份最诚挚的爱，送上最特别的节日祝福，有的同学给妈妈倒一杯水、捶一次背、有的同学做一次家务、为家长洗一次脚……看着懂事、孝顺的孩子们为长辈做力所能及的事，献出一份真情，家长们喜在心里，老师们笑在脸上。此外，一至三年级学生写一篇感恩日记，班级开展交流活动，四至六年级开展了征集感恩妈妈或老师征文活动，文章的字里行间充满感激之情，表达了对母亲或老师深深的爱。
